{
  "name": "@catwithoutear/agent-harness-core",
  "version": "1.0.0",
  "clients": {
    "codex": {
      "targets": {
        "project": {
          "skills": [
            ".agents/skills/<runtimeName>/"
          ],
          "agents": [
            ".codex/agents/<runtimeName>.toml"
          ],
          "config": [
            ".codex/"
          ],
          "hooks": [
            ".codex/hooks/<assetId>.json"
          ]
        },
        "global": {
          "skills": [
            "~/.agents/skills/<runtimeName>/"
          ],
          "agents": [
            "~/.codex/agents/<runtimeName>.toml"
          ],
          "commands": [
            "~/.codex/prompts/<assetId>.md"
          ],
          "config": [
            "~/.codex/"
          ],
          "hooks": [
            "~/.codex/hooks/<assetId>.json"
          ]
        }
      },
      "capabilities": {
        "skills": true,
        "subagents": true,
        "commands": {
          "project": false,
          "global": "deprecated"
        },
        "hooks": {
          "session-bootstrap": true,
          "active-change-guard": true,
          "tool-safety-guard": "warning",
          "regulated-structure-guard": "warning",
          "projection-health-check": true,
          "pre-compact-handoff": false
        },
        "config": true
      }
    },
    "claude": {
      "targets": {
        "project": {
          "skills": [
            ".claude/skills/<runtimeName>/"
          ],
          "agents": [
            ".claude/agents/<runtimeName>.md"
          ],
          "commands": [
            ".claude/commands/<runtimeName>.md"
          ],
          "config": [
            ".claude/"
          ],
          "hooks": [
            ".claude/hooks/<assetId>.json"
          ]
        },
        "global": {
          "skills": [
            "~/.claude/skills/<runtimeName>/"
          ],
          "agents": [
            "~/.claude/agents/<runtimeName>.md"
          ],
          "commands": [
            "~/.claude/commands/<runtimeName>.md"
          ],
          "config": [
            "~/.claude/"
          ],
          "hooks": [
            "~/.claude/hooks/<assetId>.json"
          ]
        }
      },
      "capabilities": {
        "skills": true,
        "subagents": true,
        "commands": {
          "project": true,
          "global": true
        },
        "hooks": {
          "session-bootstrap": true,
          "active-change-guard": true,
          "tool-safety-guard": true,
          "regulated-structure-guard": true,
          "projection-health-check": true,
          "pre-compact-handoff": true
        },
        "config": true
      }
    },
    "opencode": {
      "targets": {
        "project": {
          "skills": [
            ".opencode/skills/<runtimeName>/"
          ],
          "agents": [
            ".opencode/agents/<runtimeName>.md"
          ],
          "config": [
            "opencode.json"
          ],
          "hooks": [
            ".opencode/hooks/<assetId>.json"
          ]
        },
        "global": {
          "skills": [
            "~/.config/opencode/skills/<runtimeName>/"
          ],
          "agents": [
            "~/.config/opencode/agents/<runtimeName>.md"
          ],
          "config": [
            "~/.config/opencode/opencode.json"
          ],
          "hooks": [
            "~/.config/opencode/hooks/<assetId>.json"
          ]
        }
      },
      "capabilities": {
        "skills": true,
        "subagents": true,
        "commands": {
          "project": false,
          "global": false
        },
        "hooks": {
          "session-bootstrap": true,
          "active-change-guard": true,
          "tool-safety-guard": "warning",
          "regulated-structure-guard": "warning",
          "projection-health-check": true,
          "pre-compact-handoff": false
        },
        "config": true
      }
    },
    "zcode": {
      "targets": {
        "project": {
          "skills": [
            ".agents/skills/<runtimeName>/"
          ],
          "agents": [
            ".zcode/agents/<runtimeName>.md"
          ],
          "commands": [
            ".agents/commands/<runtimeName>.md"
          ],
          "config": [
            ".zcode/config.json"
          ],
          "hooks": [
            ".zcode/config.json#hooks"
          ]
        },
        "global": {
          "skills": [
            "~/.agents/skills/<runtimeName>/"
          ],
          "agents": [
            "~/.zcode/agents/<runtimeName>.md"
          ],
          "commands": [
            "~/.agents/commands/<runtimeName>.md"
          ],
          "config": [
            "~/.zcode/cli/config.json"
          ],
          "hooks": [
            "~/.zcode/cli/config.json#hooks"
          ]
        }
      },
      "capabilities": {
        "skills": true,
        "subagents": true,
        "commands": {
          "project": true,
          "global": true
        },
        "hooks": {
          "session-bootstrap": {
            "support": "native",
            "event": "SessionStart",
            "matcher": null,
            "effect": "additionalContext",
            "adapter_runtime_name": "zcode-context-adapter@1"
          },
          "active-change-guard": {
            "support": "native",
            "event": "SessionStart",
            "matcher": null,
            "effect": "additionalContext",
            "adapter_runtime_name": "zcode-context-adapter@1"
          },
          "tool-safety-guard": {
            "support": "native",
            "event": "PreToolUse",
            "matcher": "Bash|Write|Edit|ApplyPatch",
            "effect": "additionalContext",
            "adapter_runtime_name": "zcode-context-adapter@1"
          },
          "regulated-structure-guard": {
            "support": "native",
            "event": "PreToolUse",
            "matcher": "Bash|Write|Edit|ApplyPatch",
            "effect": "additionalContext",
            "adapter_runtime_name": "zcode-context-adapter@1"
          },
          "projection-health-check": {
            "support": "native",
            "event": "SessionStart",
            "matcher": null,
            "effect": "additionalContext",
            "adapter_runtime_name": "zcode-context-adapter@1"
          },
          "pre-compact-handoff": {
            "support": "unsupported"
          }
        },
        "config": true
      }
    },
    "omp": {
      "targets": {
        "project": {
          "skills": [
            ".omp/skills/<runtimeName>/"
          ],
          "agents": [
            ".omp/agents/<runtimeName>.md"
          ],
          "commands": [
            ".omp/commands/<assetId>.md"
          ],
          "config": [
            ".omp/"
          ]
        },
        "global": {
          "skills": [
            "~/.omp/skills/<runtimeName>/"
          ],
          "agents": [
            "~/.omp/agent/agents/<runtimeName>.md"
          ],
          "commands": [
            "~/.omp/agent/commands/<assetId>.md"
          ],
          "config": [
            "~/.omp/"
          ]
        }
      },
      "capabilities": {
        "skills": true,
        "subagents": true,
        "commands": {
          "project": "source-confirmed",
          "global": "source-confirmed"
        },
        "hooks": {
          "session-bootstrap": false,
          "active-change-guard": false,
          "tool-safety-guard": false,
          "regulated-structure-guard": false,
          "projection-health-check": true,
          "pre-compact-handoff": false
        },
        "config": true
      }
    }
  },
  "commands": {
    "project": "harness-project",
    "changeDoc": "harness-change-doc",
    "changeValidate": "harness-change-validate",
    "aggregate": "harness",
    "nativeRoles": "harness-native-roles"
  },
  "assets": {
    "rules": [
      {
        "id": "loop-contract",
        "source": "rules/loop-contract.md",
        "target": ".rules/loop-contract.md",
        "description": "Loop contract for recurring agent workflows.",
        "clients": [
          "codex",
          "claude",
          "opencode",
          "omp",
          "zcode"
        ]
      }
    ],
    "commands": [
      {
        "id": "harness-route",
        "source": "commands/harness/route.md",
        "runtimeName": "harness/route",
        "description": "Slash prompt for choosing the smallest correct harness skill, command, agent, hook, or projection path.",
        "clients": [
          "codex",
          "claude",
          "opencode",
          "omp",
          "zcode"
        ]
      },
      {
        "id": "harness-workflow",
        "source": "commands/harness/workflow.md",
        "runtimeName": "harness/workflow",
        "description": "Slash prompt for running the evidence-gated core workflow loop.",
        "clients": [
          "codex",
          "claude",
          "opencode",
          "omp",
          "zcode"
        ]
      },
      {
        "id": "harness-plan",
        "source": "commands/harness/plan.md",
        "runtimeName": "harness/plan",
        "description": "Slash prompt for turning settled design artifacts into bounded task slices and validation gates.",
        "clients": [
          "codex",
          "claude",
          "opencode",
          "omp",
          "zcode"
        ]
      },
      {
        "id": "harness-verify",
        "source": "commands/harness/verify.md",
        "runtimeName": "harness/verify",
        "description": "Slash prompt for selecting, running, and reporting the smallest credible validation loop.",
        "clients": [
          "codex",
          "claude",
          "opencode",
          "omp",
          "zcode"
        ]
      },
      {
        "id": "harness-review",
        "source": "commands/harness/review.md",
        "runtimeName": "harness/review",